{
  "format_version": 2,
  "id": "blank-3d",
  "name": "New 3D analysis",
  "category": "New project",
  "description": "Empty 3D fluid-volume project.",
  "capabilities": [
    "Workbench",
    "ThreeD",
    "Editable"
  ],
  "expectations": {
    "closed_domain": false,
    "positive_streamwise_flow": false,
    "curved_boundary": false,
    "non_ideal_mesh_quality": false,
    "notes": "Create a fluid volume and define named boundaries before meshing."
  },
  "project_template": {
    "format_version": 2,
    "project_id": "template-blank-3d",
    "name": "New 3D analysis",
    "geometry": {
      "cad_bodies": {},
      "hidden_profiles": [],
      "revision": 0,
      "next_vertex_id": 1,
      "next_edge_id": 1,
      "next_face_id": 1,
      "next_body_id": 1,
      "next_sketch_id": 1,
      "next_feature_id": 1,
      "vertices": {},
      "edges": {},
      "faces": {},
      "bodies": {},
      "sketches": {},
      "extrude_features": {},
      "pocket_features": {}
    },
    "plane_monitors": [],
    "fluid_face": null,
    "named_selections": [],
    "mesh": {
      "threads": 1,
      "dimension": "three-d",
      "global_size": 0.1,
      "min_size": 0.05,
      "max_size": 0.2,
      "element_order": 1
    },
    "mesh_recipe": {
      "tuning": {
        "method": "unstructured",
        "max_size_growth": null,
        "divisions": [
          40,
          40,
          10
        ],
        "progression": [
          1.0,
          1.0
        ],
        "algorithm_2d": 6,
        "algorithm_3d": 1,
        "curvature_points": 32,
        "smoothing_steps": 10,
        "optimize": true,
        "optimize_netgen": false,
        "optimize_threshold": 0.3,
        "extend_boundary_sizes": true
      },
      "edge_divisions": [],
      "regions": [],
      "local_sizes": [],
      "refinements": [],
      "boundary_layers": []
    },
    "boundaries": [],
    "material": {
      "catalog": null,
      "density": 1.0,
      "kinematic_viscosity": 0.01
    },
    "solver": {
      "pressure_coupling": {
        "algorithm": "simple",
        "pressure_correctors": 1,
        "non_orthogonal_correctors": 0,
        "non_orthogonal_limiter": 0.5
      },
      "volume_models": {
        "resistance": null,
        "rotating_frame": null
      },
      "cyclic_pairs": [],
      "equations": null,
      "boundary_profiles": {},
      "thermal": {
        "enabled": false,
        "initial_temperature": 293.15,
        "specific_heat": 1005.0,
        "conductivity": 0.025,
        "source_w_m3": 0.0,
        "relaxation": 0.7,
        "relative_tolerance": 1e-08,
        "turbulent_prandtl": 0.85,
        "wall_treatment": "molecular",
        "buoyancy": false,
        "reference_temperature": 293.15,
        "expansion": 0.0,
        "gravity": {
          "x": 0.0,
          "y": -9.81,
          "z": 0.0
        },
        "max_boussinesq_fraction": 0.1,
        "boundaries": {}
      },
      "time": {
        "mode": "steady"
      },
      "turbulence": {
        "model": "laminar",
        "wall_treatment": "resolved",
        "inlets": {},
        "k": 0.0001,
        "omega": 1.0,
        "epsilon": 1e-05,
        "nu_tilda": 1e-05,
        "relaxation": 0.5,
        "relative_tolerance": 1e-06,
        "ck": 0.094,
        "ce": 1.048,
        "cw": 0.325
      },
      "convection": "upwind",
      "threads": 0,
      "max_outer_iterations": 1000,
      "continuity_absolute_tolerance": 1e-10,
      "coupling_relative_tolerance": 1e-06,
      "velocity_relaxation": 0.7,
      "pressure_relaxation": 0.3,
      "compute": {
        "backend": "parallel",
        "adapter": "",
        "cpu_fallback": true,
        "parallel_min_rows": 4096,
        "gpu_min_rows": 16384,
        "gpu_memory_fraction": 0.8,
        "gpu_preconditioner": "auto",
        "gpu_restart": 24,
        "gpu_inner_iterations": 8,
        "gpu_smoothing_sweeps": 2,
        "gpu_timeout_ms": 10000,
        "gpu_host_basis_mb": 256
      }
    },
    "runs": []
  }
}
